title,body,labels,assignees,milestone,priority,size
"[EPIC] Security & Stability Hardening","Comprehensive security and stability improvements across the entire application. Goals: Complete error handling, security audit, performance optimization.","type: feature,priority: critical,module: core,size: xl",,"Core Stability & Security",1,XL
"[EPIC] Enhanced Purchase Invoice Lifecycle Management","Complete lifecycle management for purchase invoices including OCR, payment tracking, and tax reconciliation. Database 100%, Backend 100%, Frontend 0%.","type: feature,priority: high,module: purchases,size: xl",,"Enhanced Invoice Lifecycle",2,XL
"[EPIC] GST Compliance & Tax Reporting System","Complete GST compliance system with GSTR-1, GSTR-3B, ITC management, and filing capabilities. Backend complete, frontend partial.","type: feature,priority: critical,module: gst,size: xl",,"GST Compliance Complete",1,XL
"[EPIC] HR Management & Performance Tracking","Comprehensive HR system with shift scheduling, attendance, leave management, and performance scoring. Database and backend complete.","type: feature,priority: high,module: hr,size: xl",,"HR Management System",2,XL
"[EPIC] AI-Powered Sales Intelligence & Automation","AI-powered features for sales assistance, product recommendations, and intelligent automation using Anthropic Claude.","type: feature,priority: medium,module: ai,module: sales,size: l",,"AI & Automation",3,L
"[EPIC] Multi-Tenant Store & Business Architecture","Enable multiple businesses with complete data isolation and role-based access across stores.","type: feature,priority: medium,module: core,size: xl",,"Multi-Tenant Architecture",3,XL
"Apply Phase 4 Error Handling Pattern to All Services","Apply comprehensive error handling pattern to all 16 backend services (~124 methods). Priority services: sale, purchase-invoice, customer, product, stock.","type: enhancement,priority: high,module: core,component: backend,size: l",,"Core Stability & Security",2,L
"Invoice Document Upload with OCR Integration","Enable users to upload invoice PDF/image documents with automatic OCR data extraction. Support PDF, JPG, PNG. >85% accuracy target.","type: feature,priority: high,module: purchases,component: backend,component: frontend,size: l",,"Enhanced Invoice Lifecycle",2,L
"Payment Tracking & Reconciliation User Interface","Build frontend UI for tracking multiple payments against purchase invoices. Features: payment form, history timeline, status updates, alerts.","type: feature,priority: high,module: purchases,component: frontend,size: m",,"Enhanced Invoice Lifecycle",2,M
"GSTR-1 Report Generation Frontend Interface","Build UI for generating GSTR-1 reports (B2B, B2C Large, B2C Small, HSN Summary). Export to Excel and JSON. Backend API complete.","type: feature,priority: critical,module: gst,module: reports,component: frontend,size: m",,"GST Compliance Complete",1,M
"GSTR-3B Report Frontend Interface","Build UI for monthly GSTR-3B return generation with auto-calculation and export functionality.","type: feature,priority: critical,module: gst,component: frontend,size: m",,"GST Compliance Complete",1,M
"ITC Dashboard & Tracking Interface","Build dashboard for Input Tax Credit tracking with 180-day rule monitoring and payment risk alerts.","type: feature,priority: high,module: gst,component: frontend,size: m",,"GST Compliance Complete",2,M
"GSTR-2A/2B Reconciliation Interface","Build interface for reconciling vendor invoices with GSTR-2A/2B data from GST portal. Mismatch detection and resolution workflow.","type: feature,priority: high,module: gst,component: frontend,size: l",,"GST Compliance Complete",2,L
"Item Type Management UI (Regular/Return/Supplied)","Build UI for managing different invoice item types with return reasons and challan references.","type: feature,priority: high,module: purchases,component: frontend,size: m",,"Enhanced Invoice Lifecycle",2,M
"Tax Credit Management Interface","Build UI for managing tax credits with GSTR-2A reconciliation and ITC claim tracking.","type: feature,priority: high,module: purchases,component: frontend,size: m",,"Enhanced Invoice Lifecycle",2,M
"Invoice Closure Workflow","Implement workflow for closing completed invoices with validation checks and audit trail.","type: feature,priority: medium,module: purchases,component: frontend,size: s",,"Enhanced Invoice Lifecycle",3,S
"Purchase Effectiveness Dashboard","Build dashboard showing purchase effectiveness metrics: delivery time, pricing accuracy, quality scores.","type: feature,priority: medium,module: purchases,module: reports,component: frontend,size: m",,"Enhanced Invoice Lifecycle",3,M
"AI Sales Assistant Conversational Chat Interface","Build conversational chat interface for AI-powered sales assistant in POS. Natural language product search and recommendations.","type: feature,priority: medium,module: ai,module: sales,component: frontend,size: m",,"AI & Automation",3,M
"Smart Product Recommendations Engine","Implement AI-powered product recommendation engine based on purchase history and patterns.","type: feature,priority: medium,module: ai,component: backend,size: l",,"AI & Automation",3,L
"Shift Management System Enhancement","Enhance shift management with calendar view, coverage dashboard, and shift swap workflow.","type: feature,priority: high,module: hr,component: frontend,size: m",,"HR Management System",2,M
"Performance Scoring Dashboard","Build dashboard for employee performance tracking with leaderboards and analytics.","type: feature,priority: high,module: hr,component: frontend,size: l",,"HR Management System",2,L
"HR Analytics & Reporting Suite","Build comprehensive HR reports: attendance, leave, performance, shift coverage.","type: feature,priority: medium,module: hr,module: reports,component: frontend,size: m",,"HR Management System",3,M
"Security Audit & Penetration Testing","Conduct comprehensive security audit and penetration testing. Document findings and remediation plan.","type: security,priority: critical,module: core,size: m",,"Core Stability & Security",1,M
"Performance Benchmarking & Optimization","Establish performance benchmarks and optimize critical paths. Target: API response <200ms, page load <2s.","type: performance,priority: high,module: core,size: s",,"Core Stability & Security",2,S
"Monthly GST Closing Workflow","Implement workflow for monthly GST closing with validation, report generation, and filing preparation.","type: feature,priority: high,module: gst,size: s",,"GST Compliance Complete",2,S
"Tax Payment Integration","Integrate with payment gateway for GST tax payments with reconciliation.","type: feature,priority: medium,module: gst,size: m",,"GST Compliance Complete",3,M
"Vendor Payment Integration Enhancement","Enhance vendor payment tracking with bank reconciliation and payment status updates.","type: enhancement,priority: medium,module: purchases,size: s",,"Enhanced Invoice Lifecycle",3,S
"Inventory Optimization AI","Build AI model for inventory optimization: reorder point suggestions, stock level predictions.","type: feature,priority: medium,module: ai,module: inventory,size: l",,"AI & Automation",3,L
"Price Optimization Suggestions","Implement AI-powered price optimization based on demand, competition, and margins.","type: feature,priority: medium,module: ai,module: sales,size: m",,"AI & Automation",3,M
"Customer Purchase Predictions","Build predictive model for customer purchase behavior and recommendations.","type: feature,priority: low,module: ai,module: customers,size: l",,"AI & Automation",4,L
"Tenant Registration & Onboarding","Build tenant registration workflow with business setup, configuration, and user provisioning.","type: feature,priority: medium,module: core,size: l",,"Multi-Tenant Architecture",3,L
"Complete Data Isolation Implementation","Implement row-level security and data isolation for multi-tenant architecture.","type: feature,priority: high,module: core,component: database,size: xl",,"Multi-Tenant Architecture",2,XL
"Cross-Store Inventory Transfer","Implement inventory transfer workflow between stores with approval and tracking.","type: feature,priority: medium,module: inventory,size: m",,"Multi-Tenant Architecture",3,M
"Centralized Multi-Store Reporting","Build consolidated reports across all stores for business owners.","type: feature,priority: medium,module: reports,size: m",,"Multi-Tenant Architecture",3,M
"Store-Specific Configuration Management","Implement store-specific settings: tax rates, pricing, workflows.","type: feature,priority: medium,module: core,size: m",,"Multi-Tenant Architecture",3,M
"Subscription Billing System","Implement subscription billing for multi-tenant SaaS model with usage tracking.","type: feature,priority: medium,module: core,size: l",,"Multi-Tenant Architecture",3,L
"Update sale.service.ts Error Handling","Apply Phase 4 error handling pattern to sale.service.ts (8 methods).","type: enhancement,priority: high,module: sales,component: backend,size: s",,"Core Stability & Security",2,S
"Update purchase-invoice.service.ts Error Handling","Apply Phase 4 error handling pattern to purchase-invoice.service.ts (12 methods).","type: enhancement,priority: high,module: purchases,component: backend,size: s",,"Core Stability & Security",2,S
"Update customer.service.ts Error Handling","Apply Phase 4 error handling pattern to customer.service.ts (8 methods).","type: enhancement,priority: medium,module: customers,component: backend,size: s",,"Core Stability & Security",3,S
"Update product.service.ts Error Handling","Apply Phase 4 error handling pattern to product.service.ts (10 methods).","type: enhancement,priority: medium,module: inventory,component: backend,size: s",,"Core Stability & Security",3,S
"Update stock.service.ts Error Handling","Apply Phase 4 error handling pattern to stock.service.ts (7 methods).","type: enhancement,priority: medium,module: inventory,component: backend,size: s",,"Core Stability & Security",3,S
"Research and Select OCR Service","Research OCR services (Tesseract, Google Vision, AWS Textract, Azure). Evaluate accuracy, cost, latency. POC with sample invoices.","type: research,priority: high,module: purchases,size: xs",,"Enhanced Invoice Lifecycle",2,XS
"Implement Backend OCR Processing","Integrate selected OCR service with invoice upload endpoint. Extract invoice number, date, vendor, amounts, tax details.","type: feature,priority: high,module: purchases,component: backend,size: s",,"Enhanced Invoice Lifecycle",2,S
"Create Document Upload Component","Build Angular component for invoice document upload with drag-and-drop, file validation, progress bar.","type: feature,priority: high,module: purchases,component: frontend,size: s",,"Enhanced Invoice Lifecycle",2,S
"Build OCR Correction Interface","Create interface for users to review and correct OCR extracted data before saving.","type: feature,priority: high,module: purchases,component: frontend,size: s",,"Enhanced Invoice Lifecycle",2,S
"Add Document Preview Functionality","Implement document preview with zoom, pan, and page navigation for uploaded invoices.","type: feature,priority: medium,module: purchases,component: frontend,size: xs",,"Enhanced Invoice Lifecycle",3,XS
"Implement Document Security","Add access control and encryption for uploaded invoice documents. Audit trail for document access.","type: security,priority: high,module: purchases,component: backend,size: s",,"Enhanced Invoice Lifecycle",2,S
"Create Payment Form Component","Build Angular component for recording payments with validation and real-time balance calculation.","type: feature,priority: high,module: purchases,component: frontend,size: xs",,"Enhanced Invoice Lifecycle",2,XS
"Build Payment History Timeline","Create timeline component showing payment history with status indicators.","type: feature,priority: high,module: purchases,component: frontend,size: xs",,"Enhanced Invoice Lifecycle",2,XS
"Design Payment Summary Dashboard","Build dashboard showing payment status, outstanding amounts, and overdue alerts.","type: feature,priority: medium,module: purchases,component: frontend,size: xs",,"Enhanced Invoice Lifecycle",3,XS
"Implement Payment Reconciliation Interface","Create interface for reconciling payments with bank statements and invoice amounts.","type: feature,priority: medium,module: purchases,component: frontend,size: s",,"Enhanced Invoice Lifecycle",3,S
"Add Payment Reminder Notifications","Implement email/SMS reminders for overdue payments with configurable schedules.","type: feature,priority: low,module: purchases,size: xs",,"Enhanced Invoice Lifecycle",4,XS
"Create GSTR-1 Report Container Component","Build main container component with period selector, tabs, and export functionality.","type: feature,priority: critical,module: gst,component: frontend,size: s",,"GST Compliance Complete",1,S
"Build B2B Sales Report Table","Create data table for B2B sales (Table 4) with sorting, filtering, and validation.","type: feature,priority: critical,module: gst,component: frontend,size: s",,"GST Compliance Complete",1,S
"Build B2C Large Sales Report Table","Create data table for B2C Large sales >2.5L (Table 5) with state-wise grouping.","type: feature,priority: critical,module: gst,component: frontend,size: xs",,"GST Compliance Complete",1,XS
"Build B2C Small Sales Report Table","Create consolidated table for B2C Small sales ≤2.5L (Table 7) by state.","type: feature,priority: critical,module: gst,component: frontend,size: xs",,"GST Compliance Complete",1,XS
"Build HSN Summary Table","Create HSN-wise summary table (Table 12) with product aggregation.","type: feature,priority: critical,module: gst,component: frontend,size: xs",,"GST Compliance Complete",1,XS
"Implement Excel Export for GST Reports","Add Excel export with proper formatting, multiple sheets, and GST portal compatibility.","type: feature,priority: high,module: gst,component: frontend,size: s",,"GST Compliance Complete",2,S
"Implement JSON Export for GST Portal","Add JSON export in GST portal format for direct upload to government website.","type: feature,priority: high,module: gst,component: frontend,size: xs",,"GST Compliance Complete",2,XS
"Add GST Report Validation Logic","Implement validation checks for GST reports: GSTIN format, amount totals, date ranges.","type: feature,priority: high,module: gst,component: frontend,size: xs",,"GST Compliance Complete",2,XS
"Enhance Shift Creation Form","Improve shift creation form with recurring shift patterns and bulk assignment.","type: enhancement,priority: medium,module: hr,component: frontend,size: xs",,"HR Management System",3,XS
"Build Shift Assignment Interface","Create interface for assigning users to shifts with drag-and-drop and bulk operations.","type: feature,priority: medium,module: hr,component: frontend,size: xs",,"HR Management System",3,XS
"Create Shift Calendar Component","Build calendar component showing shift coverage with week/month views.","type: feature,priority: medium,module: hr,component: frontend,size: s",,"HR Management System",3,S
"Implement Shift Coverage Dashboard","Create dashboard showing shift coverage gaps and staffing levels.","type: feature,priority: medium,module: hr,component: frontend,size: xs",,"HR Management System",3,XS
"Add Shift Swap Workflow","Implement workflow for employees to request shift swaps with manager approval.","type: feature,priority: low,module: hr,component: frontend,size: s",,"HR Management System",4,S
"Design AI Chat UI Mockups","Create UI/UX mockups for conversational chat interface in POS system.","type: docs,priority: medium,module: ai,size: xs",,"AI & Automation",3,XS
"Build Chat Container Component","Create Angular component for chat interface with message list and input.","type: feature,priority: medium,module: ai,component: frontend,size: xs",,"AI & Automation",3,XS
"Create Message Bubble Components","Build reusable components for user and assistant message bubbles.","type: feature,priority: medium,module: ai,component: frontend,size: xs",,"AI & Automation",3,XS
"Build Product Suggestion Cards","Create product card components for AI recommendations with add-to-cart action.","type: feature,priority: medium,module: ai,component: frontend,size: xs",,"AI & Automation",3,XS
"Add Typing Indicators & Loading States","Implement typing indicators and loading animations for better UX during AI processing.","type: enhancement,priority: low,module: ai,component: frontend,size: xs",,"AI & Automation",4,XS
"Integrate Sales Intent API with Chat","Connect chat interface with backend sales intent API and handle responses.","type: feature,priority: medium,module: ai,component: frontend,size: s",,"AI & Automation",3,S
"Implement Conversation History","Add conversation history storage and display for current session.","type: feature,priority: medium,module: ai,component: frontend,size: xs",,"AI & Automation",3,XS
"Add Quick Action Buttons","Implement quick action buttons for common operations (add to cart, view details).","type: feature,priority: low,module: ai,component: frontend,size: xs",,"AI & Automation",4,XS
"Make Chat Mobile Responsive","Ensure chat interface works well on mobile devices and tablets.","type: enhancement,priority: medium,module: ai,component: frontend,size: xs",,"AI & Automation",3,XS
"Write E2E Tests for Chat Interface","Create end-to-end tests for complete chat interaction workflow.","type: feature,priority: medium,module: ai,component: testing,size: s",,"AI & Automation",3,S